{
  "$schema": "https://json-schema.org/draft/2020-12/schema",
  "$id": "https://quickdraw.local/schemas/bdq-third-update-greedy-handoff-contract.schema.json",
  "title": "QuickDraw third-update greedy-policy handoff contract",
  "type": "object",
  "additionalProperties": false,
  "required": [
    "schema_version",
    "task",
    "purpose",
    "base_third_update_contract",
    "runtime",
    "package",
    "transport",
    "collection",
    "optimization",
    "epsilon_schedule",
    "r3k_prefix",
    "post_update_greedy_handoff",
    "determinism",
    "exclusions"
  ],
  "properties": {
    "schema_version": {
      "const": "quickdraw.bdq-third-update-greedy-handoff.v1"
    },
    "task": {
      "const": "R3L"
    },
    "purpose": {
      "type": "string",
      "minLength": 1
    },
    "base_third_update_contract": {
      "const": {
        "path": "Research/trainer/bdq-third-update-contract-v1.json",
        "sha256": "930839d2a19022b6debc0ad48cfc7f64cd86ff948be2690a9989a48598cda528",
        "schema_version": "quickdraw.bdq-third-update.v1"
      }
    },
    "runtime": {
      "const": {
        "python": "3.11.13",
        "mlagents_envs": "1.1.0",
        "numpy": "1.23.5",
        "torch": "2.12.0+cpu",
        "device": "cpu"
      }
    },
    "package": {
      "const": {
        "distribution": "quickdraw-bdq-trainer",
        "version": "0.3.0",
        "metadata_path": "Research/trainer/pyproject.toml",
        "trainer_entry_points": []
      }
    },
    "transport": {
      "const": {
        "api": "mlagents_envs.environment.UnityEnvironment",
        "behavior_name": "QuickDrawResearchBasic",
        "agent_count": 1,
        "observation_shape": [
          84,
          84,
          4
        ],
        "observation_layout": "HWC",
        "observation_dtype": "float32",
        "discrete_branches": [
          3,
          2
        ],
        "transition_completion": "complete the pending action when the same agent next appears in DecisionSteps or TerminalSteps",
        "truncation_mask_transport": "quickdraw.basic-truncation-mask.v1",
        "privileged_scene_inference_permitted": false
      }
    },
    "collection": {
      "const": {
        "scenario_seed": 31001,
        "policy_seed": 51001,
        "exploration_seed": 61001,
        "selector": "seeded_scheduled_prefix_then_post_update_greedy",
        "epsilon_decay_enabled": true,
        "scheduled_transition_prefix": 10008,
        "post_update_greedy_transition_count": 1,
        "transition_limit": 10009,
        "minimum_completed_episodes": 1,
        "minimum_unique_action_tuples": 6,
        "require_no_pending_decision_at_cutoff": true
      }
    },
    "optimization": {
      "const": {
        "replay_capacity": 100000,
        "replay_warmup_decisions": 10000,
        "batch_size": 64,
        "gamma": 0.99,
        "optimizer": "Adam",
        "learning_rate": 0.0001,
        "optimizer_update_interval_decisions": 4,
        "hard_target_sync_interval_optimizer_updates": 10000,
        "expected_first_update_decision": 10000,
        "expected_update_decisions": [
          10000,
          10004,
          10008
        ],
        "expected_optimizer_updates": 3,
        "expected_target_synchronizations": 0,
        "require_finite_loss": true,
        "require_finite_mean_absolute_td_error": true,
        "require_online_weights_changed_after_each_update": true,
        "require_target_weights_unchanged": true
      }
    },
    "epsilon_schedule": {
      "const": {
        "class": "quickdraw_bdq.exploration.LinearEpsilonSchedule",
        "selector_class": "quickdraw_bdq.llapi.ScheduledEpsilonGreedyBDQActionSelector",
        "completed_transition_count_source": "BDQOptimizerController.decision_count",
        "replay_warmup_decisions": 10000,
        "decay_decisions": 100000,
        "initial_epsilon": 1,
        "final_epsilon": 0.1,
        "trace_sample_completed_transition_counts": [
          0,
          10000,
          10001,
          10004,
          10005,
          10006,
          10007
        ],
        "trace_sample_epsilons": [
          1,
          1,
          0.999991,
          0.999964,
          0.999955,
          0.999946,
          0.999937
        ],
        "selection_count": 10008,
        "full_exploration_selection_count": 10001,
        "decay_selection_count": 7,
        "first_decay_completed_transition_count": 10001,
        "last_selection_completed_transition_count": 10007,
        "continuous_selector_rng_from_completed_count_zero": true
      }
    },
    "r3k_prefix": {
      "const": {
        "transition_count": 10008,
        "canonical_transitions_sha256": "18817aa05c80a6d361dbb288665ba344fe3540bfcb067d773fbb712d1d37f9bd",
        "source_canonical_trace_sha256": "c3fafe259dfc03d69e06c758af0c2ba4df3b5da3322d325a5e361cdcf3a4ff02",
        "online_after_first_update_sha256": "7dd2365b5e219af10aeb4fabb5191df873762fcea6765cb50f83d41525279c8e",
        "online_after_second_update_sha256": "6248f286191da322a52ad0c97f569d30ecd49a1c86e9810bda4cb96ccc6b9471",
        "online_after_third_update_sha256": "4f78e397e87ad6cea1ada78d49dea808337c401f6478970d1a4439065743775b",
        "frozen_target_sha256": "b605debdd6073caa41a95d636bcf20b35d000dc959b06d5cbe585cac0bb433bb",
        "first_update_loss": 0.01628389209508896,
        "first_update_mean_absolute_td_error": 0.06243317946791649,
        "second_update_loss": 0.014819225296378136,
        "second_update_mean_absolute_td_error": 0.06711231172084808,
        "third_update_loss": 0.008735351264476776,
        "third_update_mean_absolute_td_error": 0.06769348680973053
      }
    },
    "post_update_greedy_handoff": {
      "const": {
        "selection_after_decision_count": 10008,
        "completed_transition_index": 10008,
        "required_optimizer_update_count": 3,
        "epsilon": 0,
        "production_epsilon_if_used": 0.999928,
        "action_source": "masked_argmax_thrice_updated_online_network",
        "comparison_network": "frozen_initial_target_network",
        "expected_observation_sha256": "38cb9993ce836cb711c5b740cf5abcbaf7224a341194a506a133970e74b025b8",
        "expected_action_masks": [
          [
            false,
            true,
            false
          ],
          [
            false,
            false
          ]
        ],
        "require_scheduled_selector_not_consumed": true,
        "require_finite_q_values": true,
        "require_online_target_q_divergence": true,
        "require_action_legal": true,
        "require_no_pending_decision_after_completion": true
      }
    },
    "determinism": {
      "const": {
        "fresh_processes": 2,
        "exact_trace_equality": true,
        "torch_num_threads": 1,
        "torch_num_interop_threads": 1,
        "deterministic_algorithms": true
      }
    },
    "exclusions": {
      "const": [
        "a fourth optimizer update or any extended training rollout",
        "a production epsilon-scheduled action at completed count 10008",
        "target-network synchronization",
        "checkpoint, resume, or ONNX export",
        "ROCm execution or training",
        "multi-environment collection",
        "five-seed training or held-out evaluation",
        "learned-policy effectiveness claims",
        "changes to the R2A environment or action contract",
        "watch-mode camera maintenance",
        "gradual-motion Basic variant",
        "strategic combat, reflex, or LLM runtime"
      ]
    }
  }
}
